sku,category_id,"name",description,price,brand,spec_json,created_at,updated_at
SKU00001,26,"Pintura Acrílica Bahco","Pintura acrílica Bahco de excelente cubrimiento y durabilidad. Ideal para proyectos de interior y exterior, ofreciendo un acabado profesional y resistente.",8.67,Bahco,"{""rosca"": ""Métrica"", ""material"": ""Aluminio"", ""recubrimiento"": ""Sin recubrimiento"", ""peso_gramos"": 4142}",2024-01-01T12:00:00Z,2024-01-01T12:00:00Z
SKU00002,21,"Adhesivo de Montaje Einhell","Adhesivo de montaje Einhell con agarre inicial inmediato. Fuerte y versátil, ideal para pegar materiales como madera, metal, cerámica y plástico sin necesidad de clavos.",36.04,Einhell,"{""rosca"": ""Métrica"", ""material"": ""Acero"", ""recubrimiento"": ""Galvanizado"", ""peso_gramos"": 3668}",2024-01-01T12:00:00Z,2024-01-01T12:00:00Z
SKU00003,12,"Taladro Percutor Stanley","Potente taladro percutor de la marca Stanley. Diseñado con una robusta carcasa de acero y un acabado zincado para máxima durabilidad. Ideal para perforaciones precisas.",84.02,Stanley,"{""rosca"": ""Trapezoidal"", ""material"": ""Acero"", ""recubrimiento"": ""Zincado"", ""peso_gramos"": 4660}",2024-01-01T12:00:00Z,2024-01-01T12:00:00Z
SKU00004,27,"Esmalte Sintético DeWalt","Esmalte sintético DeWalt de alta resistencia. Proporciona una capa protectora duradera contra el desgaste, perfecta para metales y maderas.",129.34,DeWalt,"{""rosca"": ""UNF"", ""material"": ""Latón"", ""recubrimiento"": ""Zincado"", ""peso_gramos"": 2169}",2024-01-01T12:00:00Z,2024-01-01T12:00:00Z
SKU00005,13,"Amoladora Angular DeWalt","Amoladora angular profesional DeWalt. Su diseño ergonómico y su peso de 3.45 kg permiten un control preciso en trabajos de corte y desbaste. Construida con plástico reforzado de alta resistencia.",185.69,DeWalt,"{""rosca"": ""UNC"", ""material"": ""Plástico reforzado"", ""recubrimiento"": ""Sin recubrimiento"", ""peso_gramos"": 3445}",2024-01-01T12:00:00Z,2024-01-01T12:00:00Z
SKU00006,8,"Llave Combinada de Latón Einhell","Llave combinada Einhell, forjada en latón de alta resistencia. Cuenta con un acabado pavonado que protege contra el óxido y garantiza una larga vida útil.",132.72,Einhell,"{""rosca"": ""UNF"", ""material"": ""Latón"", ""recubrimiento"": ""Pavonado"", ""peso_gramos"": 2878}",2024-01-01T12:00:00Z,2024-01-01T12:00:00Z
SKU00007,1,"Tornillos Trapezoidales Stanley","Tornillo especializado Stanley con rosca tipo trapezoidal. Hecho de plástico reforzado para una máxima durabilidad y con un acabado zincado para una excelente protección contra la corrosión.",228.53,Stanley,"{""rosca"": ""Trapezoidal"", ""material"": ""Plástico reforzado"", ""recubrimiento"": ""Zincado"", ""peso_gramos"": 4980}",2024-01-01T12:00:00Z,2024-01-01T12:00:00Z
SKU00008,13,"Mini Amoladora Einhell","Mini amoladora Einhell, perfecta para trabajos de precisión. Fabricada en aluminio y con un acabado protector zincado, ofrece fiabilidad y un manejo cómodo para acabados detallados.",227.84,Einhell,"{""rosca"": ""UNF"", ""material"": ""Aluminio"", ""recubrimiento"": ""Zincado"", ""peso_gramos"": 4069}",2024-01-01T12:00:00Z,2024-01-01T12:00:00Z
SKU00009,21,"Adhesivo Universal Bosch","Pegamento universal Bosch de secado rápido y transparente. Proporciona una unión fuerte y duradera en segundos, indispensable en cualquier caja de herramientas.",117.88,Bosch,"{""rosca"": ""Trapezoidal"", ""material"": ""Acero"", ""recubrimiento"": ""Galvanizado"", ""peso_gramos"": 3574}",2024-01-01T12:00:00Z,2024-01-01T12:00:00Z
SKU00010,13,"Amoladora Angular de Acero Einhell","Amoladora angular profesional Einhell. Su diseño ergonómico y su peso de 4.10 kg permiten un control preciso en trabajos de corte y desbaste. Construida con acero de alta resistencia.",151.39,Einhell,"{""rosca"": ""Trapezoidal"", ""material"": ""Acero"", ""recubrimiento"": ""Galvanizado"", ""peso_gramos"": 4101}",2024-01-01T12:00:00Z,2024-01-01T12:00:00Z
SKU00011,8,"Llave de Aluminio Bosch","Llave combinada Bosch, forjada en aluminio de alta resistencia. Cuenta con un acabado pavonado que protege contra el óxido y garantiza una larga vida útil.",149.04,Bosch,"{""rosca"": ""Métrica"", ""material"": ""Aluminio"", ""recubrimiento"": ""Pavonado"", ""peso_gramos"": 4478}",2024-01-01T12:00:00Z,2024-01-01T12:00:00Z
SKU00012,8,"Juego de Llaves Facom","Juego de llaves Facom fabricado en plástico reforzado con tratamiento sin recubrimiento. Esencial para trabajos de mecánica y mantenimiento general, ofreciendo un agarre seguro.",117.28,Facom,"{""rosca"": ""Trapezoidal"", ""material"": ""Plástico reforzado"", ""recubrimiento"": ""Sin recubrimiento"", ""peso_gramos"": 4308}",2024-01-01T12:00:00Z,2024-01-01T12:00:00Z
SKU00013,21,"Adhesivo Universal Makita","Pegamento universal Makita de secado rápido y transparente. Proporciona una unión fuerte y duradera en segundos, indispensable en cualquier caja de herramientas.",23.87,Makita,"{""rosca"": ""Trapezoidal"", ""material"": ""Plástico reforzado"", ""recubrimiento"": ""Sin recubrimiento"", ""peso_gramos"": 2410}",2024-01-01T12:00:00Z,2024-01-01T12:00:00Z
SKU00014,26,"Pintura Exterior Bahco","Pintura acrílica Bahco de excelente cubrimiento y durabilidad. Ideal para proyectos de interior y exterior, ofreciendo un acabado profesional y resistente.",96.66,Bahco,"{""rosca"": ""Whitworth"", ""material"": ""Aluminio"", ""recubrimiento"": ""Galvanizado"", ""peso_gramos"": 2418}",2024-01-01T12:00:00Z,2024-01-01T12:00:00Z
SKU00015,8,"Juego de Llaves de Acero Bosch","Juego de llaves Bosch fabricado en acero con tratamiento pavonado. Esencial para trabajos de mecánica y mantenimiento general, ofreciendo un agarre seguro.",152.69,Bosch,"{""rosca"": ""UNC"", ""material"": ""Acero"", ""recubrimiento"": ""Pavonado"", ""peso_gramos"": 2760}",2024-01-01T12:00:00Z,2024-01-01T12:00:00Z
SKU00016,1,"Tornillos de Latón UNF Einhell","Tornillo especializado Einhell con rosca tipo unf. Hecho de latón para una máxima durabilidad y con un acabado zincado para una excelente protección contra la corrosión.",159.57,Einhell,"{""rosca"": ""UNF"", ""material"": ""Latón"", ""recubrimiento"": ""Zincado"", ""peso_gramos"": 3094}",2024-01-01T12:00:00Z,2024-01-01T12:00:00Z
SKU00017,21,"Adhesivo de Montaje Makita","Adhesivo de montaje Makita con agarre inicial inmediato. Fuerte y versátil, ideal para pegar materiales como madera, metal, cerámica y plástico sin necesidad de clavos.",157.41,Makita,"{""rosca"": ""UNC"", ""material"": ""Latón"", ""recubrimiento"": ""Pavonado"", ""peso_gramos"": 1709}",2024-01-01T12:00:00Z,2024-01-01T12:00:00Z
SKU00018,8,"Llave Métrica de Aluminio Einhell","Llave combinada Einhell, forjada en aluminio de alta resistencia. Cuenta con un acabado zincado que protege contra el óxido y garantiza una larga vida útil.",173.75,Einhell,"{""rosca"": ""Métrica"", ""material"": ""Aluminio"", ""recubrimiento"": ""Zincado"", ""peso_gramos"": 2367}",2024-01-01T12:00:00Z,2024-01-01T12:00:00Z
SKU00019,13,"Mini Amoladora Makita","Mini amoladora Makita, perfecta para trabajos de precisión. Fabricada en plástico reforzado y con un acabado protector galvanizado, ofrece fiabilidad y un manejo cómodo para acabados detallados.",151.32,Makita,"{""rosca"": ""Whitworth"", ""material"": ""Plástico reforzado"", ""recubrimiento"": ""Galvanizado"", ""peso_gramos"": 581}",2024-01-01T12:00:00Z,2024-01-01T12:00:00Z
SKU00020,16,"Guantes de Seguridad Bosch","Guantes de seguridad Bosch diseñados para una protección superior. Ofrecen un excelente agarre y resistencia a la abrasión, ideales para construcción o jardinería.",241.23,Bosch,"{""rosca"": ""UNC"", ""material"": ""Latón"", ""recubrimiento"": ""Pavonado"", ""peso_gramos"": 3207}",2024-01-01T12:00:00Z,2024-01-01T12:00:00Z
SKU00021,21,"Adhesivo Profesional Bosch","Adhesivo de montaje Bosch con agarre inicial inmediato. Fuerte y versátil, ideal para pegar materiales como madera, metal, cerámica y plástico sin necesidad de clavos.",169.86,Bosch,"{""rosca"": ""Métrica"", ""material"": ""Aluminio"", ""recubrimiento"": ""Pavonado"", ""peso_gramos"": 2286}",2024-01-01T12:00:00Z,2024-01-01T12:00:00Z
SKU00022,21,"Pegamento Universal Stanley","Pegamento universal Stanley de secado rápido y transparente. Proporciona una unión fuerte y duradera en segundos, indispensable en cualquier caja de herramientas.",58.41,Stanley,"{""rosca"": ""Trapezoidal"", ""material"": ""Aluminio"", ""recubrimiento"": ""Galvanizado"", ""peso_gramos"": 3779}",2024-01-01T12:00:00Z,2024-01-01T12:00:00Z
SKU00023,16,"Guantes de Trabajo Stanley","Guantes de trabajo multiusos Stanley. Cómodos, flexibles y duraderos, proporcionan la protección necesaria para la manipulación segura de herramientas y materiales.",222.06,Stanley,"{""rosca"": ""UNF"", ""material"": ""Titanio"", ""recubrimiento"": ""Zincado"", ""peso_gramos"": 4113}",2024-01-01T12:00:00Z,2024-01-01T12:00:00Z
SKU00024,1,"Pack de Tornillos de Latón Makita","Paquete de tornillos Makita de alta resistencia. Fabricados en latón con un recubrimiento sin recubrimiento, son ideales para fijaciones seguras en todo tipo de proyectos.",196.47,Makita,"{""rosca"": ""UNF"", ""material"": ""Latón"", ""recubrimiento"": ""Sin recubrimiento"", ""peso_gramos"": 648}",2024-01-01T12:00:00Z,2024-01-01T12:00:00Z
SKU00025,16,"Guantes Multiusos Makita","Guantes de trabajo multiusos Makita. Cómodos, flexibles y duraderos, proporcionan la protección necesaria para la manipulación segura de herramientas y materiales.",123.98,Makita,"{""rosca"": ""Métrica"", ""material"": ""Acero"", ""recubrimiento"": ""Pavonado"", ""peso_gramos"": 3278}",2024-01-01T12:00:00Z,2024-01-01T12:00:00Z
SKU00026,13,"Amoladora Angular Bosch Pro","Amoladora angular profesional Bosch. Su diseño ergonómico y su peso de 2.59 kg permiten un control preciso en trabajos de corte y desbaste. Construida con aluminio de alta resistencia.",29.31,Bosch,"{""rosca"": ""Whitworth"", ""material"": ""Aluminio"", ""recubrimiento"": ""Zincado"", ""peso_gramos"": 2586}",2024-01-01T12:00:00Z,2024-01-01T12:00:00Z
SKU00027,13,"Mini Amoladora Facom","Mini amoladora Facom, perfecta para trabajos de precisión. Fabricada en plástico reforzado y con un acabado protector pavonado, ofrece fiabilidad y un manejo cómodo para acabados detallados.",146.2,Facom,"{""rosca"": ""Whitworth"", ""material"": ""Plástico reforzado"", ""recubrimiento"": ""Pavonado"", ""peso_gramos"": 4836}",2024-01-01T12:00:00Z,2024-01-01T12:00:00Z
SKU00028,12,"Taladro Inalámbrico Bosch","Taladro inalámbrico Bosch de alto rendimiento. Su construcción en acero garantiza durabilidad, mientras que su diseño ergonómico facilita el trabajo en lugares de difícil acceso.",47.35,Bosch,"{""rosca"": ""UNF"", ""material"": ""Acero"", ""recubrimiento"": ""Sin recubrimiento"", ""peso_gramos"": 2201}",2024-01-01T12:00:00Z,2024-01-01T12:00:00Z
SKU00029,16,"Guantes de Protección Bahco","Guantes de seguridad Bahco diseñados para una protección superior. Ofrecen un excelente agarre y resistencia a la abrasión, ideales para construcción o jardinería.",3.47,Bahco,"{""rosca"": ""UNC"", ""material"": ""Plástico reforzado"", ""recubrimiento"": ""Galvanizado"", ""peso_gramos"": 675}",2024-01-01T12:00:00Z,2024-01-01T12:00:00Z
SKU00030,12,"Taladro Percutor de Titanio Makita","Potente taladro percutor de la marca Makita. Diseñado con una robusta carcasa de titanio y un acabado pavonado para máxima durabilidad. Ideal para perforaciones precisas.",217.88,Makita,"{""rosca"": ""Métrica"", ""material"": ""Titanio"", ""recubrimiento"": ""Pavonado"", ""peso_gramos"": 2646}",2024-01-01T12:00:00Z,2024-01-01T12:00:00Z
SKU00031,21,"Adhesivo Universal Facom","Pegamento universal Facom de secado rápido y transparente. Proporciona una unión fuerte y duradera en segundos, indispensable en cualquier caja de herramientas.",98.69,Facom,"{""rosca"": ""Métrica"", ""material"": ""Latón"", ""recubrimiento"": ""Pavonado"", ""peso_gramos"": 838}",2024-01-01T12:00:00Z,2024-01-01T12:00:00Z
SKU00032,1,"Tornillos UNC de Plástico Bosch","Paquete de tornillos Bosch de alta resistencia. Fabricados en plástico reforzado con un recubrimiento galvanizado, son ideales para fijaciones seguras en todo tipo de proyectos.",99.42,Bosch,"{""rosca"": ""UNC"", ""material"": ""Plástico reforzado"", ""recubrimiento"": ""Galvanizado"", ""peso_gramos"": 810}",2024-01-01T12:00:00Z,2024-01-01T12:00:00Z
SKU00033,21,"Adhesivo de Montaje Facom","Adhesivo de montaje Facom con agarre inicial inmediato. Fuerte y versátil, ideal para pegar materiales como madera, metal, cerámica y plástico sin necesidad de clavos.",163.48,Facom,"{""rosca"": ""UNC"", ""material"": ""Plástico reforzado"", ""recubrimiento"": ""Sin recubrimiento"", ""peso_gramos"": 725}",2024-01-01T12:00:00Z,2024-01-01T12:00:00Z
SKU00034,26,"Pintura para Metales DeWalt","Esmalte sintético DeWalt de alta resistencia. Proporciona una capa protectora duradera contra el desgaste, perfecta para metales y maderas.",59.83,DeWalt,"{""rosca"": ""Whitworth"", ""material"": ""Titanio"", ""recubrimiento"": ""Zincado"", ""peso_gramos"": 517}",2024-01-01T12:00:00Z,2024-01-01T12:00:00Z
SKU00035,8,"Juego de Llaves de Titanio Facom","Juego de llaves Facom fabricado en titanio con tratamiento sin recubrimiento. Esencial para trabajos de mecánica y mantenimiento general, ofreciendo un agarre seguro.",157.15,Facom,"{""rosca"": ""UNC"", ""material"": ""Titanio"", ""recubrimiento"": ""Sin recubrimiento"", ""peso_gramos"": 4168}",2024-01-01T12:00:00Z,2024-01-01T12:00:00Z
SKU00036,27,"Esmalte Protector Einhell","Esmalte sintético Einhell de alta resistencia. Proporciona una capa protectora duradera contra el desgaste, perfecta para metales y maderas.",190.08,Einhell,"{""rosca"": ""UNF"", ""material"": ""Acero"", ""recubrimiento"": ""Pavonado"", ""peso_gramos"": 3090}",2024-01-01T12:00:00Z,2024-01-01T12:00:00Z
SKU00037,12,"Taladro Inalámbrico Facom Pro","Taladro inalámbrico Facom de alto rendimiento. Su construcción en titanio y su peso de 3.57 kg garantizan durabilidad y un manejo cómodo en lugares de difícil acceso.",125.23,Facom,"{""rosca"": ""Trapezoidal"", ""material"": ""Titanio"", ""recubrimiento"": ""Galvanizado"", ""peso_gramos"": 3566}",2024-01-01T12:00:00Z,2024-01-01T12:00:00Z
SKU00038,21,"Adhesivo Fuerte Stanley","Adhesivo de montaje Stanley con agarre inicial inmediato. Fuerte y versátil, ideal para pegar materiales como madera, metal, cerámica y plástico sin necesidad de clavos.",189.1,Stanley,"{""rosca"": ""Trapezoidal"", ""material"": ""Plástico reforzado"", ""recubrimiento"": ""Pavonado"", ""peso_gramos"": 2587}",2024-01-01T12:00:00Z,2024-01-01T12:00:00Z
SKU00039,8,"Llave Combinada de Latón Einhell","Llave combinada Einhell, forjada en latón de alta resistencia. Cuenta con un acabado sin recubrimiento que protege contra el óxido y garantiza una larga vida útil.",72.54,Einhell,"{""rosca"": ""Whitworth"", ""material"": ""Latón"", ""recubrimiento"": ""Sin recubrimiento"", ""peso_gramos"": 1914}",2024-01-01T12:00:00Z,2024-01-01T12:00:00Z
SKU00040,16,"Guantes Multiusos Hilti","Guantes de trabajo multiusos Hilti. Cómodos, flexibles y duraderos, proporcionan la protección necesaria para la manipulación segura de herramientas y materiales.",206.37,Hilti,"{""rosca"": ""UNC"", ""material"": ""Acero"", ""recubrimiento"": ""Sin recubrimiento"", ""peso_gramos"": 3044}",2024-01-01T12:00:00Z,2024-01-01T12:00:00Z
SKU00041,21,"Pegamento Universal Makita","Pegamento universal Makita de secado rápido y transparente. Proporciona una unión fuerte y duradera en segundos, indispensable en cualquier caja de herramientas.",161.69,Makita,"{""rosca"": ""UNC"", ""material"": ""Latón"", ""recubrimiento"": ""Sin recubrimiento"", ""peso_gramos"": 3490}",2024-01-01T12:00:00Z,2024-01-01T12:00:00Z
SKU00042,13,"Amoladora de Titanio Einhell","Amoladora angular profesional Einhell. Su diseño ergonómico y su peso de 3.66 kg permiten un control preciso en trabajos de corte y desbaste. Construida con titanio de alta resistencia.",205.55,Einhell,"{""rosca"": ""UNC"", ""material"": ""Titanio"", ""recubrimiento"": ""Zincado"", ""peso_gramos"": 3660}",2024-01-01T12:00:00Z,2024-01-01T12:00:00Z
SKU00043,12,"Taladro Compacto Einhell","Taladro inalámbrico Einhell de alto rendimiento. Su construcción en aluminio y su peso de 2.44 kg garantizan durabilidad y un manejo cómodo en lugares de difícil acceso.",46.46,Einhell,"{""rosca"": ""Trapezoidal"", ""material"": ""Aluminio"", ""recubrimiento"": ""Sin recubrimiento"", ""peso_gramos"": 2442}",2024-01-01T12:00:00Z,2024-01-01T12:00:00Z
SKU00044,26,"Pintura para Madera DeWalt","Esmalte sintético DeWalt de alta resistencia. Proporciona una capa protectora duradera contra el desgaste, perfecta para metales y maderas.",84.79,DeWalt,"{""rosca"": ""Trapezoidal"", ""material"": ""Plástico reforzado"", ""recubrimiento"": ""Pavonado"", ""peso_gramos"": 3041}",2024-01-01T12:00:00Z,2024-01-01T12:00:00Z
SKU00045,12,"Taladro de Precisión Bahco","Taladro inalámbrico Bahco de alto rendimiento. Su construcción en latón y su peso de 0.67 kg garantizan durabilidad y un manejo cómodo en lugares de difícil acceso.",16.32,Bahco,"{""rosca"": ""UNC"", ""material"": ""Latón"", ""recubrimiento"": ""Zincado"", ""peso_gramos"": 674}",2024-01-01T12:00:00Z,2024-01-01T12:00:00Z
SKU00046,21,"Adhesivo Industrial Hilti","Adhesivo de montaje Hilti con agarre inicial inmediato. Fuerte y versátil, ideal para pegar materiales como madera, metal, cerámica y plástico sin necesidad de clavos.",166.44,Hilti,"{""rosca"": ""UNF"", ""material"": ""Plástico reforzado"", ""recubrimiento"": ""Galvanizado"", ""peso_gramos"": 2203}",2024-01-01T12:00:00Z,2024-01-01T12:00:00Z
SKU00047,13,"Mini Amoladora de Titanio Bosch","Mini amoladora Bosch, perfecta para trabajos de precisión. Fabricada en titanio y con un acabado protector galvanizado, ofrece fiabilidad y un manejo cómodo para acabados detallados.",248.09,Bosch,"{""rosca"": ""Whitworth"", ""material"": ""Titanio"", ""recubrimiento"": ""Galvanizado"", ""peso_gramos"": 1288}",2024-01-01T12:00:00Z,2024-01-01T12:00:00Z
SKU00048,21,"Adhesivo Universal DeWalt","Pegamento universal DeWalt de secado rápido y transparente. Proporciona una unión fuerte y duradera en segundos, indispensable en cualquier caja de herramientas.",88.54,DeWalt,"{""rosca"": ""Whitworth"", ""material"": ""Aluminio"", ""recubrimiento"": ""Sin recubrimiento"", ""peso_gramos"": 3873}",2024-01-01T12:00:00Z,2024-01-01T12:00:00Z
SKU00049,1,"Tornillos Métricos Makita","Paquete de tornillos Makita de alta resistencia. Fabricados en plástico reforzado con un recubrimiento galvanizado, son ideales para fijaciones seguras en todo tipo de proyectos.",176.32,Makita,"{""rosca"": ""Métrica"", ""material"": ""Plástico reforzado"", ""recubrimiento"": ""Galvanizado"", ""peso_gramos"": 3954}",2024-01-01T12:00:00Z,2024-01-01T12:00:00Z
SKU00050,21,"Adhesivo de Montaje Einhell","Adhesivo de montaje Einhell con agarre inicial inmediato. Fuerte y versátil, ideal para pegar materiales como madera, metal, cerámica y plástico sin necesidad de clavos.",115.47,Einhell,"{""rosca"": ""Trapezoidal"", ""material"": ""Aluminio"", ""recubrimiento"": ""Galvanizado"", ""peso_gramos"": 466}",2024-01-01T12:00:00Z,2024-01-01T12:00:00Z
SKU00051,8,"Llave Ajustable Facom","Llave combinada Facom, forjada en plástico reforzado de alta resistencia. Cuenta con un acabado sin recubrimiento que protege contra el óxido y garantiza una larga vida útil.",68.67,Facom,"{""rosca"": ""UNF"", ""material"": ""Plástico reforzado"", ""recubrimiento"": ""Sin recubrimiento"", ""peso_gramos"": 4874}",2024-01-01T12:00:00Z,2024-01-01T12:00:00Z
SKU00052,8,"Juego de Llaves de Titanio Einhell","Juego de llaves Einhell fabricado en titanio con tratamiento pavonado. Esencial para trabajos de mecánica y mantenimiento general, ofreciendo un agarre seguro.",165.42,Einhell,"{""rosca"": ""Trapezoidal"", ""material"": ""Titanio"", ""recubrimiento"": ""Pavonado"", ""peso_gramos"": 4797}",2024-01-01T12:00:00Z,2024-01-01T12:00:00Z
SKU00053,13,"Amoladora de Acero Hilti","Amoladora angular profesional Hilti. Su diseño ergonómico y su peso de 1.66 kg permiten un control preciso en trabajos de corte y desbaste. Construida con acero de alta resistencia.",76.4,Hilti,"{""rosca"": ""Whitworth"", ""material"": ""Acero"", ""recubrimiento"": ""Zincado"", ""peso_gramos"": 1657}",2024-01-01T12:00:00Z,2024-01-01T12:00:00Z
SKU00054,16,"Guantes de Trabajo Bahco","Guantes de trabajo multiusos Bahco. Cómodos, flexibles y duraderos, proporcionan la protección necesaria para la manipulación segura de herramientas y materiales.",113.85,Bahco,"{""rosca"": ""Métrica"", ""material"": ""Aluminio"", ""recubrimiento"": ""Pavonado"", ""peso_gramos"": 1526}",2024-01-01T12:00:00Z,2024-01-01T12:00:00Z
SKU00055,12,"Taladro Inalámbrico Einhell","Taladro inalámbrico Einhell de alto rendimiento. Su construcción en acero y su peso de 2.34 kg garantizan durabilidad y un manejo cómodo en lugares de difícil acceso.",156.87,Einhell,"{""rosca"": ""Métrica"", ""material"": ""Acero"", ""recubrimiento"": ""Pavonado"", ""peso_gramos"": 2339}",2024-01-01T12:00:00Z,2024-01-01T12:00:00Z
SKU00056,21,"Pegamento Instantáneo Facom","Pegamento universal Facom de secado rápido y transparente. Proporciona una unión fuerte y duradera en segundos, indispensable en cualquier caja de herramientas.",193.64,Facom,"{""rosca"": ""Trapezoidal"", ""material"": ""Plástico reforzado"", ""recubrimiento"": ""Pavonado"", ""peso_gramos"": 287}",2024-01-01T12:00:00Z,2024-01-01T12:00:00Z
SKU00057,1,"Pack de Tornillos de Acero Stanley","Paquete de tornillos Stanley de alta resistencia. Fabricados en acero con un recubrimiento zincado, son ideales para fijaciones seguras en todo tipo de proyectos.",220.86,Stanley,"{""rosca"": ""Whitworth"", ""material"": ""Acero"", ""recubrimiento"": ""Zincado"", ""peso_gramos"": 1099}",2024-01-01T12:00:00Z,2024-01-01T12:00:00Z
SKU00058,13,"Amoladora Profesional DeWalt","Amoladora angular profesional DeWalt. Su diseño ergonómico y su peso de 3.69 kg permiten un control preciso en trabajos de corte y desbaste. Construida con plástico reforzado de alta resistencia.",216.59,DeWalt,"{""rosca"": ""UNF"", ""material"": ""Plástico reforzado"", ""recubrimiento"": ""Sin recubrimiento"", ""peso_gramos"": 3687}",2024-01-01T12:00:00Z,2024-01-01T12:00:00Z
SKU00059,1,"Tornillos de Latón Whitworth Facom","Tornillo especializado Facom con rosca tipo whitworth. Hecho de latón para una máxima durabilidad y con un acabado sin recubrimiento para una excelente protección contra la corrosión.",101.05,Facom,"{""rosca"": ""Whitworth"", ""material"": ""Latón"", ""recubrimiento"": ""Sin recubrimiento"", ""peso_gramos"": 753}",2024-01-01T12:00:00Z,2024-01-01T12:00:00Z
SKU00060,13,"Mini Amoladora de Titanio Makita","Mini amoladora Makita, perfecta para trabajos de precisión. Fabricada en titanio y con un acabado protector galvanizado, ofrece fiabilidad y un manejo cómodo para acabados detallados.",229.45,Makita,"{""rosca"": ""UNC"", ""material"": ""Titanio"", ""recubrimiento"": ""Galvanizado"", ""peso_gramos"": 121}",2024-01-01T12:00:00Z,2024-01-01T12:00:00Z
SKU00061,16,"Guantes de Seguridad Bahco","Guantes de seguridad Bahco diseñados para una protección superior. Ofrecen un excelente agarre y resistencia a la abrasión, ideales para construcción o jardinería.",76.43,Bahco,"{""rosca"": ""UNC"", ""material"": ""Titanio"", ""recubrimiento"": ""Pavonado"", ""peso_gramos"": 2562}",2024-01-01T12:00:00Z,2024-01-01T12:00:00Z
SKU00062,8,"Juego de Llaves de Aluminio DeWalt","Juego de llaves DeWalt fabricado en aluminio con tratamiento sin recubrimiento. Esencial para trabajos de mecánica y mantenimiento general, ofreciendo un agarre seguro.",109.24,DeWalt,"{""rosca"": ""Whitworth"", ""material"": ""Aluminio"", ""recubrimiento"": ""Sin recubrimiento"", ""peso_gramos"": 2879}",2024-01-01T12:00:00Z,2024-01-01T12:00:00Z
SKU00063,26,"Pintura Multisuperficie Hilti","Pintura acrílica Hilti de excelente cubrimiento y durabilidad. Ideal para proyectos de interior y exterior, ofreciendo un acabado profesional y resistente.",137.46,Hilti,"{""rosca"": ""Métrica"", ""material"": ""Plástico reforzado"", ""recubrimiento"": ""Galvanizado"", ""peso_gramos"": 1297}",2024-01-01T12:00:00Z,2024-01-01T12:00:00Z
SKU00064,1,"Pack de Tornillos UNC Hilti","Paquete de tornillos Hilti de alta resistencia. Fabricados en aluminio con un recubrimiento pavonado, son ideales para fijaciones seguras en todo tipo de proyectos.",35.93,Hilti,"{""rosca"": ""UNC"", ""material"": ""Aluminio"", ""recubrimiento"": ""Pavonado"", ""peso_gramos"": 4807}",2024-01-01T12:00:00Z,2024-01-01T12:00:00Z
SKU00065,8,"Llave de Titanio Bahco","Llave combinada Bahco, forjada en titanio de alta resistencia. Cuenta con un acabado sin recubrimiento que protege contra el óxido y garantiza una larga vida útil.",107.61,Bahco,"{""rosca"": ""Whitworth"", ""material"": ""Titanio"", ""recubrimiento"": ""Sin recubrimiento"", ""peso_gramos"": 2883}",2024-01-01T12:00:00Z,2024-01-01T12:00:00Z
SKU00066,27,"Esmalte Anticorrosivo Facom","Esmalte sintético Facom de alta resistencia. Proporciona una capa protectora duradera contra el desgaste, perfecta para metales y maderas.",52.6,Facom,"{""rosca"": ""UNC"", ""material"": ""Acero"", ""recubrimiento"": ""Zincado"", ""peso_gramos"": 1759}",2024-01-01T12:00:00Z,2024-01-01T12:00:00Z
SKU00067,8,"Juego de Llaves DeWalt Pro","Juego de llaves DeWalt fabricado en acero con tratamiento pavonado. Esencial para trabajos de mecánica y mantenimiento general, ofreciendo un agarre seguro.",234.35,DeWalt,"{""rosca"": ""Trapezoidal"", ""material"": ""Acero"", ""recubrimiento"": ""Pavonado"", ""peso_gramos"": 492}",2024-01-01T12:00:00Z,2024-01-01T12:00:00Z
